name,company,category,description,innovation,website,linkedin,email
"Dr. Anna Schmidt","GreenMobility GmbH","Sustainable Transport","Leading developer of hydrogen-powered urban buses","Zero-emission bus fleet with 500km range","https://greenmobility.example.com","https://linkedin.com/in/anna-schmidt","anna.schmidt@example.com"
"Michael Chen","AutoPilot Technologies","Autonomous Driving","Pioneer in Level 4 autonomous vehicle systems","Self-driving delivery vehicles for last-mile logistics","https://autopilot-tech.example.com","https://linkedin.com/in/michael-chen","michael.chen@example.com"
"Sarah Martinez","ChargePoint Solutions","E-Mobility Infrastructure","Innovator in ultra-fast charging technology","350kW charging stations with 5-minute charge time","https://chargepoint.example.com","https://linkedin.com/in/sarah-martinez","sarah.martinez@example.com"
"Dr. Thomas Weber","RailTech Innovation","Smart Rail Systems","Digital transformation expert for railway systems","AI-powered predictive maintenance for trains","https://railtech.example.com","https://linkedin.com/in/thomas-weber","thomas.weber@example.com"
"Elena Popov","MicroMobility Hub","Urban Mobility","Creator of integrated micro-mobility platforms","Multi-modal transport app connecting bikes, scooters, and public transit","https://micromobility.example.com","https://linkedin.com/in/elena-popov","elena.popov@example.com"